447365,Guardiões da Galáxia: Volume 3;2023-05-03;1383,71;en;0;Guardians of the Galaxy Vol. 3;8,10;1516;Peter Quill, que ainda está a recuperar da perda de Gamora, tem que reunir a sua equipa para defender o universo e proteger um dos seus. Uma missão que, se não for concluída com sucesso, pode levar ao fim dos Guardiões como os conhecemos.
603692,John Wick 4: Baba Yaga;2023-03-22;3390,35;en;0;John Wick: Chapter 4;8,00;1758;Com o preço por sua cabeça cada vez maior, John Wick leva sua luta contra a alta mesa global enquanto procura os jogadores mais poderosos do submundo, de Nova York a Paris, de Osaka a Berlim.
916224,Suzume;2022-11-11;785,46;ja;0;すずめの戸締まり;7,90;386;A história de Suzume, uma garota japonesa de 17 anos, que conhece um jovem rapaz procurando por uma "porta". Os dois viajam juntos e a encontram dentro de algumas ruínas numa montanha e cercada por água em seu redor, como se tivesse ocorrido algum desastre e ela fora o único objeto restante. Suzume a abre e então, as "Portas do Desastre" começam a se abrir ao redor do Japão, uma após a outra, trazendo desastres intermináveis.
502356,Super Mario Bros.: O Filme;2023-04-05;5480,46;en;0;The Super Mario Bros. Movie;7,70;3347;Os irmãos Mario e Luigi, de ascendência italiana, vivem em Brooklyn (Nova Iorque), onde trabalham como canalizadores. Certo dia, durante um serviço de reparação de uma conduta de água, são sugados por um tubo e transportados para o Reino Cogumelo, um universo paralelo governado pela Princesa Peach. Sem saber do paradeiro do irmão, Mario vai ter de aprender a sobreviver naquele lugar, adquirindo capacidades bizarras mas que serão grandes mais-valias para destruir os planos de Bowser, um verdadeiro vilão que tenciona dominar o mundo.
76600,Avatar: O Caminho da Água;2022-12-14;1299,92;en;0;Avatar: The Way of Water;7,70;8148;12 anos depois de explorar Pandora e se juntar aos Na'vi, Jake Sully formou uma família com Neytiri e se estabeleceu entre os clãs do novo mundo. Porém, a paz não durará para sempre.
882569,The Covenant;2023-04-19;1365,67;en;0;Guy Ritchie's The Covenant;7,60;321;Um sargento do Exército é resgatado de uma missão no Afeganistão pelo seu intérprete. Naquela que seria a sua última missão no estrangeiro, Kinley fica à beira da morte mas sobrevive graças a Ahmed, que o protege e o carrega por quilometros a fim de garantir a sua segurança. Sem se lembrar muito bem do que aconteceu, o sargento apenas sabe que quando o homem se encontra em risco de vida, como a sua família, é a sua verdadeira missão retribuir o favor e ajudá-lo a sobreviver.
