569094,Homem-Aranha: Através do Aranhaverso;2023-05-31;2796,05;en;0;Spider-Man: Across the Spider-Verse;8,80;982;Miles Morales regressa para o próximo capítulo da saga Universo-Aranha, vencedora de um Óscar. Uma aventura épica que transportará o amigo da vizinhança de Brooklyn, Homem-Aranha, através do Multiverso para unir forças com Gwen Stacy e uma nova equipa de Pessoas-Aranha. Miles, Gwen e esta equipa irão enfrentar um vilão muito mais poderoso do que qualquer outro antes encontrado.
324857,Homem-Aranha: No Universo-Aranha;2018-12-06;896,57;en;0;Spider-Man: Into the Spider-Verse;8,40;13011;Miles Morales é um adolescente comum até descobrir que depois de ter sido picado por uma aranha, adquiriu superpoderes. Fã incondicional do Homem-Aranha, ele decide seguir-lhe os passos e dá início a uma vida dupla onde se dedica a capturar vilões e salvar pessoas em perigo. É então que lhe aparece o melhor professor que alguma vez poderia desejar: o próprio Peter Parker. Agora, para enfrentar um poderoso inimigo que ameaça destruir o mundo, Morales e Parker vão procurar todos os homens-aranha existentes nos diversos universos alternativos…
447365,Guardiões da Galáxia: Volume 3;2023-05-03;1058,90;en;0;Guardians of the Galaxy Vol. 3;8,10;1882;Peter Quill, que ainda está a recuperar da perda de Gamora, tem que reunir a sua equipa para defender o universo e proteger um dos seus. Uma missão que, se não for concluída com sucesso, pode levar ao fim dos Guardiões como os conhecemos.
603692,John Wick: Capítulo 4;2023-03-22;3701,12;en;0;John Wick: Chapter 4;7,90;2787;John Wick descobre uma forma de derrotar a High Table que governa as organizações criminosas mais poderosas do submundo. Mas antes de ganhar a sua liberdade, Wick tem de enfrentar um novo inimigo com alianças poderosas e forças que transformam velhos amigos em inimigos.
502356,Super Mario Bros. O Filme;2023-04-05;2947,91;en;0;The Super Mario Bros. Movie;7,80;4488;Os irmãos Mario e Luigi, de ascendência italiana, vivem em Brooklyn (Nova Iorque), onde trabalham como canalizadores. Certo dia, durante um serviço de reparação de uma conduta de água, são sugados por um tubo e transportados para o Reino Cogumelo, um universo paralelo governado pela Princesa Peach. Sem saber do paradeiro do irmão, Mario vai ter de aprender a sobreviver naquele lugar, adquirindo capacidades bizarras mas que serão grandes mais-valias para destruir os planos de Bowser, um verdadeiro vilão que tenciona dominar o mundo.
667538,Transformers: O Despertar das Feras;2023-06-06;1643,40;en;0;Transformers: Rise of the Beasts;7,70;100;Os robôs humanóides autobots foram forçados a abandonar Cybertron, o seu planeta natal, e rumar ao planeta Terra. No percurso, tiveram de defrontar os decepticons, seus inimigos mortais, acabando por ir para vários lugares no universo em vez do seu destino final. Esta nova aventura, ambientada em 1994, decorre em Brooklyn (Nova Iorque) e segue Noah e Elena, dois humanos que se juntam a Optimus Prime, o líder supremo dos pacíficos autobots, que tantas vezes lutaram pela salvação do mundo. Os três vêem-se envolvidos num conflito relacionado com outras facções de cybertronianos: Maximals, Predacons e Terrorcons. E desta vez a guerra é de tal magnitude que nada parece ser suficiente para a travar.
